{
  "schema_version": "1.0",
  "frame_id": 120,
  "t_capture": 12.345678,
  "hand_id": "RIGHT",
  "present": true,
  "detector_id": "example-hand-landmarker",
  "landmarks": [
    [
      0.4,
      0.5
    ],
    [
      0.41000000000000003,
      0.505
    ],
    [
      0.42000000000000004,
      0.51
    ],
    [
      0.43000000000000005,
      0.515
    ],
    [
      0.44,
      0.52
    ],
    [
      0.45,
      0.525
    ],
    [
      0.46,
      0.53
    ],
    [
      0.47000000000000003,
      0.535
    ],
    [
      0.48000000000000004,
      0.54
    ],
    [
      0.49,
      0.545
    ],
    [
      0.5,
      0.55
    ],
    [
      0.51,
      0.555
    ],
    [
      0.52,
      0.56
    ],
    [
      0.53,
      0.565
    ],
    [
      0.54,
      0.5700000000000001
    ],
    [
      0.55,
      0.575
    ],
    [
      0.56,
      0.58
    ],
    [
      0.5700000000000001,
      0.585
    ],
    [
      0.5800000000000001,
      0.59
    ],
    [
      0.5900000000000001,
      0.595
    ],
    [
      0.6000000000000001,
      0.6
    ]
  ],
  "landmark_visibility": [
    0.9,
    0.9,
    0.9,
    0.9,
    0.9,
    0.9,
    0.9,
    0.9,
    0.9,
    0.9,
    0.9,
    0.9,
    0.9,
    0.9,
    0.9,
    0.9,
    0.9,
    0.9,
    0.9,
    0.9,
    0.9
  ],
  "handedness_score": 0.95,
  "bbox": [
    0.38,
    0.48,
    0.25,
    0.2
  ]
}
